{
  "schema_version": "1.0",
  "handoff_id": "GFX-EVD-FASTHOSTS-UPGRADE-REBOOT-READINESS",
  "packet_id": "REBOOT-RECOVERY-P0-P5-CERT",
  "created_at_utc": "2026-09-30T02:00:00Z",
  "branch": "main",
  "base_commit": "244f1baf317bd773763a3968bec0225aa61caa1b",
  "head_commit": null,
  "commands": [
    "docker exec -i guvfx-backend python manage.py shell < estate_check.py   # READ-ONLY 25/35/36 exposure + identity",
    "docker exec -i guvfx-backend python manage.py shell < arming_check.py   # READ-ONLY arming machinery + delivery_ready",
    "ssh guvfx-windows-mt5 powershell ... Get-NetTCPConnection/qwinsta        # READ-ONLY bridge + terminal + session health",
    "ssh guvfx-windows-mt5 powershell ... Test-Path Probe-GuvfxSession.ps1 + Select-String PROBE_SESSION  # host deploy state",
    "ssh ubuntu@VPS crontab -l | grep run_hosted_session_reconciler          # reconciler cron state"
  ],
  "expected_results": [
    "FASTHOSTS_UPGRADE_REBOOT_READY only if EVERY arming prerequisite for HOSTED_SESSION_RECONCILER_ARM_SELFCONNECT_ENABLED is proven; else identify the blocker and DO NOT issue (never weaken to probe-only)",
    "fresh gates: 25/35/36 flat (0 open trades, 0 active plans), bridges healthy, 25/35/36 identity/strategy/magic/sizing unchanged",
    "arming machinery present in prod (host executor armed, GUAC configured, delivery_ready, workspace_node present + node-agree)",
    "recovery path DEPLOYED (backend code + PROBE_SESSION host-op + reconciler cron) so unattended recovery can run at the supervised reboot"
  ],
  "actual_results": [
    "FRESH GATES GREEN: 25=0 open/0 plans magic 1000000010; 35=0/0 magic 1000000016; 36=0/0 magic 1000000019 (all persistent_workspace demo active, untouched). Bridges 8788/8789/8804/8805 LISTENING; 6 terminal64; 11 guvfx sessions.",
    "ARMING MACHINERY PROVEN in prod: HOSTED_HOST_EXECUTOR_ENABLED=1 + resolve_host_executor non-None for 25/35/36; GUAC_BASE_URL + GUAC_JSON_SECRET_KEY_HEX set; 25/35/36 delivery_ready=true, workspace_node=node2 (rdp 100.79.101.19), execution_node==workspace_node (node-agree).",
    "P4-c/P5 governed tests + adversarial certification COMPLETE (all merged; every SHIP-WITH-FIXES finding applied). Probe-GuvfxSession.ps1 ParseFile-validated on Windows PowerShell 5.1.26100 (RULE 9 + RULE 11 controls).",
    "BLOCKER 1: P4/P5 backend code NOT deployed to prod (reconciler flags read NO_FLAG in the running guvfx-backend).",
    "BLOCKER 2: PROBE_SESSION host-op NOT deployed (Probe-GuvfxSession.ps1 not staged; deployed executor lib has no PROBE_SESSION) -> the reconciler cannot probe -> automatic recovery is non-functional.",
    "BLOCKER 3: session-reconciler cron NOT scheduled (absent from crontab + compose) -> the reconciler would never run after boot.",
    "VERDICT: NOT YET FASTHOSTS_UPGRADE_REBOOT_READY. Blockers 1-3 must be cleared (Sponsor-gated deploy+arm) and the fresh gates re-confirmed before issuance."
  ],
  "status": "PARTIAL",
  "limitations": [
    "This is a WITHHELD certification: the recovery subsystem + estate + arming machinery are ready, but the recovery PATH is not deployed (blockers 1-3), so unattended recovery cannot run. Per the Sponsor rule, the cert is NOT issued and the blockers are identified; it was NOT weakened to probe-only to permit the upgrade.",
    "End-to-end probe->establish->session has NEVER executed against the real prod host/guacd (no prod spike permitted; feasibility proven only by the isolated 12/12 harness). By the Sponsor's revised framing this is validated AT the supervised reboot, not before — it is not counted as a pre-cert blocker, but it means unattended recovery is unproven-in-prod until the reboot.",
    "The cron cadence is a deployment setting not in the repo; the (MAX_ESTABLISH_PER_CYCLE=4, cadence) pair vs the reboot-recovery SLA must be settled before arming.",
    "Both flags remain OFF. Nothing was deployed, enabled, or rebooted. No estate mutation; all checks read-only. 25/35/36 identity/strategy/magic/sizing untouched; P0 MT5_BRIDGE_THREADED remains OFF.",
    "RDS SPLA/SAL remains a separate written commercial licensing gate before 20-account production enablement (out of scope here)."
  ],
  "artefact_locations": [
    "docs/FASTHOSTS_UPGRADE_REBOOT_READINESS.md (full certification: sequence, timing, backoff, concurrency, failure states, audit, rollback, fresh gates, arming-prerequisite table, deploy+arm sequence)",
    "memory: project_host_reboot_recovery_gap.md",
    "P0-P5 merged: 4da49d5 216142a 92114f1 2ab679b 2ab7d65 cfa25e3 b41cd1c caff68d 244f1ba"
  ],
  "checksums": {
    "docs/FASTHOSTS_UPGRADE_REBOOT_READINESS.md": "sha256:a34fc6462321199971f6cc03407d05913e2c580469cda873f37dd71fff885126"
  },
  "reviewer": "pending-sponsor"
}
